text,category
"The mobile app keyboard covers the submit button on the complaint form.",technical_issue
"The loan calculator returns an error for valid loan amounts.",technical_issue
"The website keeps asking me to clear cache but still does not work.",technical_issue
"I cannot receive in-app approval prompts for UPI transactions.",technical_issue
"The branch locator map does not load any locations.",technical_issue
"The app logs out whenever I switch to SMS to read OTP.",technical_issue
"The scanned cheque image is not visible in the deposit status page.",technical_issue
"The card PIN change page fails after final confirmation.",technical_issue
"The digital passbook sync has not updated for a week.",technical_issue
"The transaction receipt share button crashes the app.",technical_issue
"What is the minimum balance requirement for a salary account?",general
"Please tell me how to request a new cheque book.",general
"I want information about senior citizen fixed deposit rates.",general
"How can I find my bank IFSC code?",general
"Please explain the process to add a nominee.",general
"What is the charge for issuing a demand draft?",general
"Can you tell me the branch lunch timings?",general
"How do I enable international usage on my debit card?",general
"What is the maximum UPI transfer limit per day?",general
"Please explain how to register for internet banking.",general
"I want to know the documents needed for current account opening.",general
"How can I check my reward points balance?",general
"Please share the process for getting a duplicate passbook.",general
"What is the timeline for debit card delivery?",general
"Can you tell me the charges for SMS alerts?",general
"How do I update my nominee for fixed deposit?",general
"What are the locker nomination rules?",general
"Please explain the tax saving fixed deposit lock-in period.",general
"I want details about doorstep banking services.",general
"How can I request a solvency certificate?",general
"What is the process to issue a balance certificate?",general
"Can I schedule an appointment with the branch manager?",general
"Please tell me the NEFT holiday schedule.",general
"How do I enable email statements every month?",general
"What is the difference between savings and current account?",general
"Please explain debit card variants and annual charges.",general
"How can I apply for a forex card?",general
"What documents are required for opening an NRI account?",general
"Please tell me how to stop paper statements.",general
"How do I generate a UPI ID in the banking app?",general
"What is the process for changing account operating instructions?",general
"Can I request a cheque stop payment online?",general
"Please explain the charges for outward remittance.",general
"How can I get a bank account closure form?",general
"What is the cutoff time for same-day RTGS?",general
"Please provide information about recurring deposit maturity.",general
"How do I apply for mobile number registration at branch?",general
"Can I link multiple accounts to one debit card?",general
"What are the documents required for locker application?",general
"Please explain how to download Form 16A from net banking.",general
